{
  "$defs": {
    "ArtifactReferenceV1": {
      "additionalProperties": false,
      "description": "Immutable reference to an exact artifact and contract version.",
      "properties": {
        "artifact_id": {
          "pattern": "^[A-Za-z0-9][A-Za-z0-9._:-]{0,127}$",
          "title": "Artifact Id",
          "type": "string"
        },
        "artifact_type": {
          "minLength": 1,
          "title": "Artifact Type",
          "type": "string"
        },
        "schema_id": {
          "pattern": "^detailed-analysis\\.[a-z0-9]+(?:-[a-z0-9]+)*$",
          "title": "Schema Id",
          "type": "string"
        },
        "schema_version": {
          "minimum": 1,
          "title": "Schema Version",
          "type": "integer"
        },
        "sha256": {
          "pattern": "^[0-9a-f]{64}$",
          "title": "Sha256",
          "type": "string"
        }
      },
      "required": [
        "artifact_type",
        "artifact_id",
        "schema_id",
        "schema_version",
        "sha256"
      ],
      "title": "ArtifactReferenceV1",
      "type": "object"
    },
    "OperationType": {
      "description": "Required logical operations independent of concrete CLI spelling.",
      "enum": [
        "validate_task",
        "start",
        "preflight",
        "status",
        "interrupt",
        "cancel",
        "resume",
        "rerun",
        "record_human_decision",
        "show_artifact"
      ],
      "title": "OperationType",
      "type": "string"
    },
    "TaskExecutionState": {
      "description": "Approved task-level states without a Finalized state.",
      "enum": [
        "running",
        "interrupting",
        "suspended",
        "awaiting_human_decision",
        "analysis_completed",
        "failed",
        "cancelled"
      ],
      "title": "TaskExecutionState",
      "type": "string"
    }
  },
  "$id": "urn:stock-research-llm-orchestrator:detailed-analysis.operation-request:v1",
  "$schema": "https://json-schema.org/draft/2020-12/schema",
  "additionalProperties": false,
  "description": "Auditable logical operation input without secret credential values.",
  "properties": {
    "credential_aliases": {
      "items": {
        "pattern": "^[A-Za-z0-9][A-Za-z0-9._:-]{0,127}$",
        "type": "string"
      },
      "title": "Credential Aliases",
      "type": "array"
    },
    "expected_task_state": {
      "anyOf": [
        {
          "$ref": "#/$defs/TaskExecutionState"
        },
        {
          "type": "null"
        }
      ]
    },
    "human_decision_reference": {
      "anyOf": [
        {
          "$ref": "#/$defs/ArtifactReferenceV1"
        },
        {
          "type": "null"
        }
      ]
    },
    "input_references": {
      "items": {
        "$ref": "#/$defs/ArtifactReferenceV1"
      },
      "title": "Input References",
      "type": "array"
    },
    "manifest_reference": {
      "anyOf": [
        {
          "$ref": "#/$defs/ArtifactReferenceV1"
        },
        {
          "type": "null"
        }
      ]
    },
    "non_interactive_inputs_complete": {
      "const": true,
      "title": "Non Interactive Inputs Complete",
      "type": "boolean"
    },
    "operation_id": {
      "pattern": "^[A-Za-z0-9][A-Za-z0-9._:-]{0,127}$",
      "title": "Operation Id",
      "type": "string"
    },
    "operation_type": {
      "$ref": "#/$defs/OperationType"
    },
    "operator": {
      "minLength": 1,
      "title": "Operator",
      "type": "string"
    },
    "parent_task_id": {
      "anyOf": [
        {
          "pattern": "^[A-Za-z0-9][A-Za-z0-9._:-]{0,127}$",
          "type": "string"
        },
        {
          "type": "null"
        }
      ],
      "title": "Parent Task Id"
    },
    "reason": {
      "minLength": 1,
      "title": "Reason",
      "type": "string"
    },
    "requested_at": {
      "pattern": "^\\d{4}-\\d{2}-\\d{2}T\\d{2}:\\d{2}:\\d{2}(?:\\.\\d+)?(?:Z|[+-]\\d{2}:\\d{2})$",
      "title": "Requested At",
      "type": "string"
    },
    "schema_id": {
      "const": "detailed-analysis.operation-request",
      "title": "Schema Id",
      "type": "string"
    },
    "schema_version": {
      "const": 1,
      "title": "Schema Version",
      "type": "integer"
    },
    "task_id": {
      "anyOf": [
        {
          "pattern": "^[A-Za-z0-9][A-Za-z0-9._:-]{0,127}$",
          "type": "string"
        },
        {
          "type": "null"
        }
      ],
      "title": "Task Id"
    },
    "task_reference": {
      "anyOf": [
        {
          "$ref": "#/$defs/ArtifactReferenceV1"
        },
        {
          "type": "null"
        }
      ]
    }
  },
  "required": [
    "schema_id",
    "schema_version",
    "operation_id",
    "operation_type",
    "requested_at",
    "operator",
    "task_id",
    "parent_task_id",
    "task_reference",
    "manifest_reference",
    "expected_task_state",
    "input_references",
    "credential_aliases",
    "human_decision_reference",
    "reason",
    "non_interactive_inputs_complete"
  ],
  "title": "OperationRequestV1",
  "type": "object"
}
